{
  "$schema": "../schema/build_plan.schema.json",
  "meta": {
    "reviewed_by": ["architect", "chief_engineer"],
    "as_of": "2026-07-04",
    "summary": "Sustainability review of all 19 backlog items. The finding both reviewers converged on: build the shared foundations FIRST, because four of the features are themselves platform primitives (F7=pre-signal hook, F11=fill capture, F17=run ledger, F18=state schema) and three others would each fork the code if built naively (F6/F15 sizing+cost, F3 attribution). Four prerequisite refactors (R1-R4) unify what is already diverging before we add to it. Foundations P0-A..P0-I are the architectural primitives; R1/R2/R3 are the concrete refactor tickets that realize C/B/A, R4 hardens the invariant-3 test. Every item is placed in exactly one of five dependency-ordered phases; validate.py enforces that nothing is dropped and dependencies flow forward.",
    "phase_order_note": "Statistical validity (Phase 1) is sequenced before data integrity (Phase 2) on purpose: F1 (point-in-time data) is blocked on external vendor procurement, while the stats work is pure code and unblocked, so it proceeds in parallel with data acquisition. The Architect's counter (don't certify survivorship-biased data) is handled by the continuous-backlog rule: F2's DSR/PBO is re-run once F1 lands, and every synthetic/non-PIT result keeps its banner (invariant #5)."
  },
  "foundations": [
    {"id": "P0-A", "title": "Volume/ADV in the data layer", "why": "data.py fetches only Close; F6 impact costs and F15 ADV caps both need real trailing volume. Build once with a versioned cache key so old Close-only parquet caches invalidate.", "enables": ["F6", "F15", "F9"], "touches": ["trading_algo/data.py", "trading_algo/regions.py"], "risk_if_skipped": "F6 and F15 each fetch volume ad-hoc with divergent lookback/adjustment conventions.", "effort": "M"},
    {"id": "P0-B", "title": "Fill capture in execution + paper trade log", "why": "execution_ibkr.rebalance() calls placeOrder() and discards the result; no trade records decision price vs fill. F3, F10 and F11 all need realized fills.", "enables": ["F11", "F3", "F10"], "touches": ["trading_algo/execution_ibkr.py", "trading_algo/paper_trade.py"], "risk_if_skipped": "Three features invent three different Trade/fill schemas and AUD-conversion conventions.", "effort": "S"},
    {"id": "P0-C", "title": "One unified cost function across engines", "why": "backtest.py charges cost as turnover*rate; paper_trade.py inlines slippage into the fill price then adds commission+stamp separately. Two cost paths already diverge before F6.", "enables": ["F6", "F15"], "touches": ["trading_algo/fees.py", "trading_algo/backtest.py", "trading_algo/paper_trade.py"], "risk_if_skipped": "F6 adds a third divergent cost path, reintroducing the exact backtest-vs-live gap F3 exists to detect.", "effort": "M"},
    {"id": "P0-D", "title": "Pre-signal data pipeline hook", "why": "One seam both backtest and paper/live call before compute_targets. F7's data-quality gate IS this hook; F14's fallback provider and F1's eligibility plug into the same slot.", "enables": ["F7", "F14", "F1"], "touches": ["trading_algo/data.py", "trading_algo/data_quality.py (new)"], "risk_if_skipped": "A fallback feed (F14) bypasses the quality gate (F7) because they are bolted on separately.", "effort": "M"},
    {"id": "P0-E", "title": "Shared equity validation/stats module", "why": "metrics.py already computes Sharpe independently of forex/validation.py's validated DSR/PBO math. Promote the FX stats to a shared module instead of adding a third copy.", "enables": ["F2", "F8", "F19"], "touches": ["trading_algo/forex/validation.py (promote to shared)", "trading_algo/metrics.py"], "risk_if_skipped": "Equity DSR silently uses different Sharpe math than the FX side's validated implementation.", "effort": "S"},
    {"id": "P0-F", "title": "Notification/telemetry channel", "why": "The engine runs unattended via cron; the breaker halt today only prints to a log. F12 (breaker), F9 (crowding) and F10 (promotion audit) all need to notify.", "enables": ["F12", "F9", "F10"], "touches": ["trading_algo/engine.py", "trading_algo/paper_trade.py", "trading_algo/config.py"], "risk_if_skipped": "Three bespoke, inconsistent alert paths.", "effort": "S"},
    {"id": "P0-G", "title": "Run-manifest + experiment ledger", "why": "sweep.py results are printed, never persisted; F2's DSR needs a real n_trials count, which would otherwise be a guessed constant. F17 IS this foundation.", "enables": ["F2", "F3", "F10", "F17"], "touches": ["trading_algo/manifest.py (new)", "trading_algo/sweep.py"], "risk_if_skipped": "F2's DSR/PBO gate reports a defensible-looking number backed by an arbitrary trial count.", "effort": "S"},
    {"id": "P0-H", "title": "Schema-validated state files", "why": "paper_state_{account}.json is one flat untyped dict. F4 (cross-currency rebalance), F10 (promotion read) and F18 (schema) all touch it. F18 IS this foundation.", "enables": ["F10", "F4", "F18"], "touches": ["trading_algo/paper_trade.py"], "risk_if_skipped": "A shape change in one consumer silently breaks the other; F10 trusts a corrupted-but-parseable file.", "effort": "S"},
    {"id": "P0-I", "title": "Capacity-aware sizing channel inside compute_targets", "why": "compute_targets has no liquidity/cost input; trimming weights AFTER it in each caller recreates a second weight path. This is the single biggest invariant-#3 risk in the backlog.", "enables": ["F15", "F6"], "touches": ["trading_algo/strategy.py", "tests/test_consistency.py"], "risk_if_skipped": "Paper and backtest apply the ADV cap differently because it lives outside the one shared function.", "effort": "M"}
  ],
  "prerequisite_refactors": [
    {"id": "R1", "title": "Unify the two cost paths into one fees.py entrypoint", "before": ["F6", "F15"], "why": "backtest uses round_trip_cost_rate (turnover x rate); paper_trade inlines slippage into fill price then calls commission/stamp separately. F6 would add a third divergent path and make its own AC1 regression claim unstateable. Realizes foundation P0-C.", "effort": "M"},
    {"id": "R2", "title": "Capture ib_insync fill/Trade results in execution_ibkr.rebalance()", "before": ["F3", "F10", "F11"], "why": "rebalance() calls ib.placeOrder() and discards the result today; three features need realized fills and would each invent a different capture schema. Realizes foundation P0-B.", "effort": "S"},
    {"id": "R3", "title": "Centralize ADV/volume ingestion in data.py", "before": ["F6", "F15"], "why": "Both F6 (impact) and F15 (ADV cap) need trailing volume that data.py doesn't fetch; building it twice yields divergent lookback/adjustment conventions. Realizes foundation P0-A.", "effort": "S"},
    {"id": "R4", "title": "Strengthen test_consistency.py beyond string-grep", "before": ["F3", "F9", "F15"], "why": "The current guard only checks source text ('compute_targets' present, 'select_portfolio' absent); a second sizing path could satisfy the grep while still bypassing compute_targets. Add numeric golden-fixture equality (backtest vs paper weights/costs bit-identical).", "effort": "S"}
  ],
  "phases": [
    {"phase": 0, "name": "Foundations & safety rails", "goal": "Build the platform primitives and safety nets that carry no capital risk and unblock everything else, before anything touches sizing, cost, or live paths.", "foundations": ["P0-D", "P0-E", "P0-F", "P0-G", "P0-H"], "items": ["F7", "F16", "F17", "F18"], "exit_criteria": "Data-quality gate live and default-on; CI backtest baseline green over 5 stable runs; every run emits a schema-valid manifest; state files validated on load with a migration path. Refactors R1/R2/R3/R4 landed or ticketed just-in-time before their Phase-3/4 consumers.", "effort": "M"},
    {"phase": 1, "name": "Statistical validity", "goal": "Certify the strategy's numbers honestly using the shared stats module, so no curve-fit parameter set reaches the book. Pure code, unblocked, runs in parallel with data procurement.", "foundations": ["P0-E", "P0-G"], "items": ["F8", "F2", "F19"], "exit_criteria": "Purged/embargoed CV (embargo >= 21d, n_folds >= 6) feeds DSR/PBO with n_trials == real sweep grid size; every reported backtest shows DSR + PBO + a haircut Sharpe next to the raw number.", "effort": "M"},
    {"phase": 2, "name": "Data integrity", "goal": "Make the prices and the universe the numbers are computed on trustworthy; re-run Phase-1 certification once real point-in-time data lands.", "foundations": ["P0-D"], "items": ["F1", "F13", "F14"], "exit_criteria": "run_backtest --point-in-time on real membership files for all 3 regions with >=99% reconciliation and a printed static-vs-PIT CAGR delta; delisted terminal returns represented; a feed 403 falls back through the F7 gate.", "effort": "L"},
    {"phase": 3, "name": "Execution realism & capacity", "goal": "Model real-world cost and liquidity, and instrument fills — all routed through the unified cost path and the compute_targets capacity hook so invariant #3 holds.", "foundations": ["P0-A", "P0-C", "P0-I", "P0-B", "P0-F"], "items": ["F6", "F15", "F11", "F12", "F9"], "exit_criteria": "Impact-model-off reproduces today's flat-cost numbers byte-for-byte; ADV cap applied identically in backtest and paper; per-region realized-vs-modelled slippage reported; breaker alerts once per transition; crowding monitor proven read-only.", "effort": "L"},